<?xml version='1.0' encoding='utf-8'?>
<ns0:SMC_Sequenz xmlns:ns0="http://ccsap.bit.admin.ch/SWISSMEDIC/LIMS_HMIT_KHZ" xmlns:xsi="http://www.w3.org/2001/XMLSchema-instance" xsi:schemaLocation="http://ccsap.bit.admin.ch/SWISSMEDIC/LIMS_HMIT_KHZ https://ogd.swissmedic.ch/hmd/ZL/172/Beschreibungen/OGD-Sequenzen.xsd"><SEQUENZ><ZULASSUNGSNUMMER>10029</ZULASSUNGSNUMMER><SEQUENZNUMMER>2</SEQUENZNUMMER><ZULASSUNGSSTATUS>Z</ZULASSUNGSSTATUS><WIDERRUF_VERZICHT_DATUM /><SEQUENZNAME>Zeller Herz und Nerven Classic, Tropfen zum Einnehmen</SEQUENZNAME><ZULASSUNGSART>H</ZULASSUNGSART><BASIS_SEQUENZNUMMER>0</BASIS_SEQUENZNUMMER><ANWENDUNGSGEBIET>Bei nervösen Herzbeschwerden</ANWENDUNGSGEBIET><DECLA_HMV4>X</DECLA_HMV4></SEQUENZ><SEQUENZ><ZULASSUNGSNUMMER>10167</ZULASSUNGSNUMMER><SEQUENZNUMMER>1</SEQUENZNUMMER><ZULASSUNGSSTATUS>Z</ZULASSUNGSSTATUS><WIDERRUF_VERZICHT_DATUM /><SEQUENZNAME>Emser Salz, Pulver zur Herstellung einer Nasenspülung/Mundspülung/Gurgellösung oder Lösung zu Inhalation</SEQUENZNAME><ZULASSUNGSART>H</ZULASSUNGSART><BASIS_SEQUENZNUMMER>0</BASIS_SEQUENZNUMMER><ANWENDUNGSGEBIET>Katarrhalische Erkrankungen der Atemwege</ANWENDUNGSGEBIET><DECLA_HMV4>X</DECLA_HMV4></SEQUENZ><SEQUENZ><ZULASSUNGSNUMMER>30514</ZULASSUNGSNUMMER><SEQUENZNUMMER>2</SEQUENZNUMMER><ZULASSUNGSSTATUS>D</ZULASSUNGSSTATUS><WIDERRUF_VERZICHT_DATUM>2026-07-17</WIDERRUF_VERZICHT_DATUM><SEQUENZNAME>Spersadex comp., collyre en solution</SEQUENZNAME><ZULASSUNGSART>H</ZULASSUNGSART><BASIS_SEQUENZNUMMER>0</BASIS_SEQUENZNUMMER><ANWENDUNGSGEBIET>Infections oculaires</ANWENDUNGSGEBIET><DECLA_HMV4>X</DECLA_HMV4></SEQUENZ><SEQUENZ><ZULASSUNGSNUMMER>32238</ZULASSUNGSNUMMER><SEQUENZNUMMER>1</SEQUENZNUMMER><ZULASSUNGSSTATUS>D</ZULASSUNGSSTATUS><WIDERRUF_VERZICHT_DATUM>2026-07-22</WIDERRUF_VERZICHT_DATUM><SEQUENZNAME>Tannosynt flüssig, Konzentrat zur Herstellung einer Lösung zur Anwendung auf der Haut</SEQUENZNAME><ZULASSUNGSART>H</ZULASSUNGSART><BASIS_SEQUENZNUMMER>0</BASIS_SEQUENZNUMMER><ANWENDUNGSGEBIET>Entzündliche, nässende und juckende Hauterkrankungen</ANWENDUNGSGEBIET><DECLA_HMV4>X</DECLA_HMV4></SEQUENZ><SEQUENZ><ZULASSUNGSNUMMER>90001</ZULASSUNGSNUMMER><SEQUENZNUMMER>1</SEQUENZNUMMER><ZULASSUNGSSTATUS>Z</ZULASSUNGSSTATUS><WIDERRUF_VERZICHT_DATUM /><SEQUENZNAME>Fixture Vet Drops, Tropfen zum Einnehmen</SEQUENZNAME><ZULASSUNGSART>H</ZULASSUNGSART><BASIS_SEQUENZNUMMER>0</BASIS_SEQUENZNUMMER><ANWENDUNGSGEBIET>Veterinary fixture product</ANWENDUNGSGEBIET><DECLA_HMV4>X</DECLA_HMV4></SEQUENZ></ns0:SMC_Sequenz>